{"base_clean_tree":true,"base_commit":"bcf13823abc162a608e187b26bbf683f759f385e","base_git_tree_oid":"74d10964d7470b2b9d92ba734550825388178d2d","base_source_file_count":92,"base_source_manifest_digest":"sha256:fa702701eddea5eef676a22a0d8a66ab30d081ed36fa0e557c05eca9b0a5a91c","base_source_manifest_id":"poke-engine-source-bcf13823","base_source_tree_digest":"sha256:05e99c0f396dcb48e020cd0536872264c3a0a2381db728a2d6d1ddf3478b9a1f","base_tag":"v0.0.48","base_tag_peeled_commit":"bcf13823abc162a608e187b26bbf683f759f385e","canonicalization_profile":"rfc8785-jcs-v1","cargo_lock":{"path":"Cargo.lock","sha256":"sha256:1b190156a1e575fe086cf240b81af1984623657b2b00dc423fd347094f0169d7","size":12707},"downstream_patches":[{"application":"git-apply-exact-v1","format":"git-diff-binary-full-index-unified-zero-v1","ordinal":1,"path":"artifacts/gen9ou/m2/engine/downstream-patches/poke-engine-legal-choices-v1.patch","role":"legal-choice-binding","sha256":"sha256:c3af469fb9f9a90ca0b5b731398d5a138725a1b1e5b6c790f86fedc0d1aa8dfe","size":6254},{"application":"git-apply-exact-v1","format":"git-diff-binary-full-index-unified-zero-v1","ordinal":2,"path":"artifacts/gen9ou/m2/engine/downstream-patches/poke-engine-resolved-action-order-v1.patch","role":"resolved-action-order-binding","sha256":"sha256:eca5c97d2cd9cb7484c4c41221aa686a7960981d8d0e0ec6e17649245864ba10","size":11250}],"license":{"path":"LICENSE","sha256":"sha256:38ce7f13fdac0ed9fa428649747dacc7e1fc0f4e4842239e4e0c53cefc450b4d","size":1066,"spdx_id":"MIT"},"manifest_id":"poke-engine-source-bcf13823-downstream-resolved-order-v3","repository_url":"https://github.com/pmariglia/poke-engine","resulting_source_is_committed":false,"retrieved_on":"2026-08-08","schema_id":"urn:battlebelief:schema:manifest:engine-source:v3","schema_version":3,"source_file_count":92,"source_files":[{"git_mode":"100644","path":".github/workflows/publish.yml","sha256":"sha256:d7f9eda8c162e9931e1d818baacba0597266451feae1c93617a431fc7c11582b","size":656},{"git_mode":"100644","path":".github/workflows/tests.yml","sha256":"sha256:4ed2bd187794f4c8908538df7d1a542045e2f44b69228910c862488f0a4be0b5","size":340},{"git_mode":"100644","path":".gitignore","sha256":"sha256:e3a2f08a42071c4c142d9abaaa457670140175782b6e75d9a7da289a20a39f94","size":77},{"git_mode":"100644","path":".readthedocs.yaml","sha256":"sha256:f1882a33e7cd40b6d2309f691b54c5538dfc118e265adc641977218345d7bf75","size":693},{"git_mode":"100644","path":"CHANGELOG.md","sha256":"sha256:4a37a99e208d8fbc69646a246f052ac9122a7785eb5f432d9caff8a132725258","size":53496},{"git_mode":"100644","path":"Cargo.lock","sha256":"sha256:1b190156a1e575fe086cf240b81af1984623657b2b00dc423fd347094f0169d7","size":12707},{"git_mode":"100644","path":"Cargo.toml","sha256":"sha256:ecaf252e62a66f31a7ebe6db75b16b110ee260e6cdd76e36f0fe72ee458c8921","size":819},{"git_mode":"100644","path":"LICENSE","sha256":"sha256:38ce7f13fdac0ed9fa428649747dacc7e1fc0f4e4842239e4e0c53cefc450b4d","size":1066},{"git_mode":"100644","path":"Makefile","sha256":"sha256:04ca26c4d2e1f7a8342b4348b0e535457fec10aa9c2d1bc2d25a4332711acef2","size":2855},{"git_mode":"100644","path":"README.md","sha256":"sha256:da0b8665cc91c74b4cedf5c1dd4ee151abce72208bc731041021415bc647c8cd","size":8844},{"git_mode":"100644","path":"cliff.toml","sha256":"sha256:c3f9e7259926c4f537f783fc73d10c155f2d121c43dc638bfa760ffc0813fb3e","size":1330},{"git_mode":"100644","path":"data/benchmark.rs","sha256":"sha256:5433b900e8a8d12b364bc2af080a9c8776e79ef2711144afe4e682c161b607f8","size":1882},{"git_mode":"100644","path":"data/gen9randombattle.txt","sha256":"sha256:a34af565c711b1179051a3fcda9360feb1ab22c4818665c45b3b2ec628ec4df3","size":307365},{"git_mode":"100644","path":"poke-engine-py/Cargo.toml","sha256":"sha256:f16b7df5ab1679fbe4e746bf4e385e5c22c7dad504ae7528720068aac628e55e","size":292},{"git_mode":"100644","path":"poke-engine-py/__init__.py","sha256":"sha256:e3b0c44298fc1c149afbf4c8996fb92427ae41e4649b934ca495991b7852b855","size":0},{"git_mode":"100755","path":"poke-engine-py/build_and_publish","sha256":"sha256:dd074b4f5b78f278a836cbbcce912115e32b1541c85ccb1b47b80632359df9e8","size":125},{"git_mode":"100644","path":"poke-engine-py/docs/Makefile","sha256":"sha256:e33bf74d59130029ba24168a813112dd923d7044d780ce942db6645d93f56acf","size":638},{"git_mode":"100644","path":"poke-engine-py/docs/make.bat","sha256":"sha256:2f82394fbb835088f01b231127ecbd1684fad6cc48c82b9a62e2722edf1cfa70","size":804},{"git_mode":"100644","path":"poke-engine-py/docs/source/changelog.rst","sha256":"sha256:fc1dbd62380c31d88599917f005cf0eac025060a75c9ef4d581fc5baefa60e1a","size":58},{"git_mode":"100644","path":"poke-engine-py/docs/source/conf.py","sha256":"sha256:93855025fff69deb5825e7e780b2e2e5d0cab36e53be639d32c7d762313714eb","size":963},{"git_mode":"100644","path":"poke-engine-py/docs/source/examples.rst","sha256":"sha256:0bf3aacebed9c51a3093c9acbccf2db957783a53a595b028613f1481c373100a","size":118},{"git_mode":"100644","path":"poke-engine-py/docs/source/index.rst","sha256":"sha256:f008141b8f5690839d66971704cc394b0e14e00fe69ac8002425618d3f612ee2","size":125},{"git_mode":"100644","path":"poke-engine-py/docs/source/installation.rst","sha256":"sha256:8dbb233fee13719406148b5c4d9c9bb9d75188f245e2cba595a7204f4a6b36fc","size":817},{"git_mode":"100644","path":"poke-engine-py/docs/source/reference.rst","sha256":"sha256:78969213c6c280e6a43ff8e9ea37a21c32eec3b319f6078bea3efad89fa4e1bb","size":61},{"git_mode":"100644","path":"poke-engine-py/examples/calculate_damage.py","sha256":"sha256:e7dd6465d3b47f21480afa8d90a5b1480d91afd938404153c47257b778b82c1f","size":178},{"git_mode":"100644","path":"poke-engine-py/examples/example_state.py","sha256":"sha256:1ba02b638a39ed03d065910680267e1a476fa67ddf868b00014392e3a885e8f1","size":3768},{"git_mode":"100644","path":"poke-engine-py/examples/generate_instructions.py","sha256":"sha256:655422a8df9bbff507819c653eef5ebbda446b82b0dea6ce711ca1867a232957","size":407},{"git_mode":"100644","path":"poke-engine-py/examples/monte_carlo_search.py","sha256":"sha256:8b74cb6bdc3ab77d0741823b862c580dfe4b253ee4426c8578122f5239e51125","size":341},{"git_mode":"100644","path":"poke-engine-py/pyproject.toml","sha256":"sha256:2a0313235b399b0a9af752f1c78af097d112807b292dffce5ebd326112afc5e6","size":227},{"git_mode":"100644","path":"poke-engine-py/python/__init__.py","sha256":"sha256:e3b0c44298fc1c149afbf4c8996fb92427ae41e4649b934ca495991b7852b855","size":0},{"git_mode":"100644","path":"poke-engine-py/python/poke_engine/__init__.py","sha256":"sha256:1c0ea75c3436415e1d97348437d86cfb5e8634bce721b26d701d53f5a0243244","size":4970},{"git_mode":"100644","path":"poke-engine-py/python/poke_engine/poke_engine.pyi","sha256":"sha256:4c9cf2355f23832a31ac98001c04e8cea428f9926f108cf917991f45b140354c","size":14752},{"git_mode":"100644","path":"poke-engine-py/python/tests/__init__.py","sha256":"sha256:e3b0c44298fc1c149afbf4c8996fb92427ae41e4649b934ca495991b7852b855","size":0},{"git_mode":"100644","path":"poke-engine-py/python/tests/test_poke_engine.py","sha256":"sha256:01933227c5e6b28371c2395e114e403652a55b7f3534dc1855e3de5948e39c27","size":9652},{"git_mode":"100644","path":"poke-engine-py/readme.md","sha256":"sha256:e01647972aac9f6989a3b34fbead0486fbe4a8aaf5225035150de18f7fe44630","size":179},{"git_mode":"100644","path":"poke-engine-py/requirements-dev.txt","sha256":"sha256:85b94641c645134d0ffdcbff7164dfd6ffc69fd71524ecd65f80011e6c42649b","size":83},{"git_mode":"100644","path":"poke-engine-py/requirements.txt","sha256":"sha256:1bf8e49864c89b1f3eebbd8dad0922c57f5e92c3b5b12036a53a98c79801b4c5","size":14},{"git_mode":"100644","path":"poke-engine-py/src/lib.rs","sha256":"sha256:598948e860e2fda0f732897de6a28954ae7982923cd00996de80de5e04a427ab","size":35388},{"git_mode":"100755","path":"release","sha256":"sha256:399c5ea27fb498bb9d3a3fe9e7bbd0f05968b8a8ca14adc3fc658f1db8146302","size":1304},{"git_mode":"100644","path":"src/choices.rs","sha256":"sha256:22bffc066b7cc8ff286187914364b84389da8aa10b774516aab9576f9d382424","size":613540},{"git_mode":"100644","path":"src/gen1/abilities.rs","sha256":"sha256:16d08b5b4a7d07a884042738fcae59c96d02242511406c202d20f12ffd358151","size":240},{"git_mode":"100644","path":"src/gen1/base_stats.rs","sha256":"sha256:3edb1025dd29fdb50e3aa23d0aaf1cd2813c5b3123ec61615c36770f563188c2","size":16109},{"git_mode":"100644","path":"src/gen1/choice_effects.rs","sha256":"sha256:067e680a46aa09004d112f2047d4e6fc95f91f812b0d9176ad94a8b5237e4585","size":9577},{"git_mode":"100644","path":"src/gen1/damage_calc.rs","sha256":"sha256:7c9584f88baf30192f6bf7ff9bf63f74c729415e7b61794275d35662a24eec9d","size":8704},{"git_mode":"100644","path":"src/gen1/evaluate.rs","sha256":"sha256:7afc65e0006a4f60ac11f5aab724081d18b7d0b533dfbc046d5eb57cbc9a96a1","size":6979},{"git_mode":"100644","path":"src/gen1/generate_instructions.rs","sha256":"sha256:198a25961ed089e6eebafea0d4ecf736baf927d251cfeba84710556d27cf734e","size":68473},{"git_mode":"100644","path":"src/gen1/items.rs","sha256":"sha256:69189cad755c8883c85f6fdd0529f84cb828a23048edcf19c0160c79ef9aff36","size":919},{"git_mode":"100644","path":"src/gen1/mod.rs","sha256":"sha256:ede866a804d1177a40708d3c177d84c219c537057d87ef5c0ba60a34192c65ee","size":163},{"git_mode":"100644","path":"src/gen1/state.rs","sha256":"sha256:66b00c53e71204df89e3d8bf6245ed251807f0cbaea256f29a118825e1cbe70f","size":19650},{"git_mode":"100644","path":"src/gen2/abilities.rs","sha256":"sha256:16d08b5b4a7d07a884042738fcae59c96d02242511406c202d20f12ffd358151","size":240},{"git_mode":"100644","path":"src/gen2/base_stats.rs","sha256":"sha256:01ba4719c80b6fe911b091a7c05124b64eeece964e09c058ef8f9805daca546b","size":1},{"git_mode":"100644","path":"src/gen2/choice_effects.rs","sha256":"sha256:3f7cb231000951e97335c29887f6115348701575a3de88ab9fac377f7a71de4e","size":26787},{"git_mode":"100644","path":"src/gen2/damage_calc.rs","sha256":"sha256:7067b0062eed2a4342e882aab9971a12d1bd2ef247133d4bde68d5272765126f","size":11479},{"git_mode":"100644","path":"src/gen2/evaluate.rs","sha256":"sh